{
  "$schema": "http://json-schema.org/draft-07/schema#",
  "title": "HoloScript GPU bench receipt v2",
  "description": "Unified bench-receipt shape for GPU/CPU-substitute captures across the paper program. Every paper bench artifact SHOULD emit this shape so reviewers can immediately tell which execution path produced a number — the path field is the camera-ready honesty knob.",
  "type": "object",
  "required": ["receipt_version", "captured_at", "path", "paper", "hardware", "kernel", "results"],
  "properties": {
    "receipt_version": {
      "const": "v2",
      "description": "Schema version. v1 = pre-2026-05-29 ad-hoc shape; v2 = this schema."
    },
    "captured_at": {
      "type": "string",
      "format": "date-time",
      "description": "ISO-8601 timestamp at the moment the harness emitted the receipt."
    },
    "path": {
      "enum": ["webgpu-browser", "cpu-component", "cpu-substitute", "cuda-native", "wasm-simd", "wgpu-native"],
      "description": "The execution path that produced these numbers. webgpu-browser = real WebGPU in a real browser (Playwright + Chromium with navigator.gpu adapter). cpu-component = a CPU baseline for related primitives that is not algorithmically equivalent to the GPU kernel. cpu-substitute = a deterministic CPU implementation of the same algorithm. cuda-native = libcuda/CUDA C++. wasm-simd = WASM SIMD path. wgpu-native = wgpu Rust binding native build."
    },
    "paper": {
      "type": "string",
      "description": "Stable paper identifier matching the audit-matrix row (e.g. paper-4-sandbox-usenix, trust-by-construction-paper, paper-2-snn-neurips)."
    },
    "section": {
      "type": ["string", "null"],
      "description": "Optional section reference within the paper (e.g. '7.8', '5.1', 'Table III')."
    },
    "harness": {
      "type": "string",
      "description": "Repo-relative path to the test/script that produced this receipt."
    },
    "hardware": {
      "type": "object",
      "required": ["tier", "label", "cpu"],
      "properties": {
        "tier": { "enum": ["H1", "H2", "H3"] },
        "label": { "type": "string" },
        "gpu": { "type": "string" },
        "cpu": { "type": "string" },
        "cpuCount": { "type": "number" },
        "ramGb": { "type": "number" },
        "platform": { "type": "string" },
        "release": { "type": "string" },
        "arch": { "type": "string" },
        "node": { "type": "string" },
        "tierConfidence": { "enum": ["env", "detected", "fallback"] }
      }
    },
    "adapter_info": {
      "type": ["object", "null"],
      "description": "Browser-selected WebGPU adapter metadata when Chromium exposes it; it may be empty or null.",
      "properties": {
        "vendor": { "type": "string" },
        "architecture": { "type": "string" },
        "device": { "type": "string" },
        "description": { "type": "string" }
      }
    },
    "browser_gpu_info": {
      "type": ["object", "null"],
      "description": "Chromium GPU-process identity from CDP SystemInfo.getInfo. This independently binds the browser GPU process but does not by itself prove which physical device WebGPU selected.",
      "required": ["schema_version", "source", "scope", "webgpu_adapter_selection_proven", "devices"],
      "properties": {
        "schema_version": { "const": "holoscript.chromium-gpu-info.v1" },
        "source": { "const": "chromium-cdp-system-info" },
        "scope": { "const": "chromium-gpu-process" },
        "webgpu_adapter_selection_proven": { "const": false },
        "devices": {
          "type": "array",
          "items": {
            "type": "object",
            "properties": {
              "vendor_id": { "type": ["integer", "null"] },
              "device_id": { "type": ["integer", "null"] },
              "sub_sys_id": { "type": ["integer", "null"] },
              "revision": { "type": ["integer", "null"] },
              "vendor": { "type": ["string", "null"] },
              "device": { "type": ["string", "null"] },
              "driver_vendor": { "type": ["string", "null"] },
              "driver_version": { "type": ["string", "null"] }
            }
          }
        },
        "aux_attributes": {
          "type": "object",
          "additionalProperties": {
            "type": ["string", "boolean", "number"]
          }
        },
        "feature_status": {
          "type": "object",
          "additionalProperties": { "type": "string" }
        },
        "driver_bug_workarounds": {
          "type": "array",
          "items": { "type": "string" }
        }
      }
    },
    "host_gpu_inventory": {
      "type": "object",
      "description": "Independent host-visible GPU inventory from vendor and platform providers. This proves visible host hardware, not WebGPU adapter selection.",
      "required": ["schema_version", "source", "platform", "scope", "webgpu_adapter_selection_proven", "devices"],
      "properties": {
        "schema_version": {
          "enum": [
            "holoscript.host-gpu-inventory.v1",
            "holoscript.host-gpu-inventory.v2"
          ]
        },
        "source": {
          "enum": [
            "nvidia-smi",
            "windows-cim",
            "linux-lspci",
            "macos-system-profiler",
            "multi-provider",
            "unavailable"
          ]
        },
        "platform": { "type": "string" },
        "scope": { "const": "host-inventory" },
        "webgpu_adapter_selection_proven": { "const": false },
        "providers": {
          "type": "array",
          "items": {
            "type": "object",
            "required": ["name", "status", "device_count"],
            "properties": {
              "name": {
                "enum": [
                  "nvidia-smi",
                  "windows-cim",
                  "linux-lspci",
                  "macos-system-profiler"
                ]
              },
              "status": {
                "enum": ["available", "empty", "unavailable"]
              },
              "device_count": {
                "type": "integer",
                "minimum": 0
              },
              "reason": { "type": "string" }
            }
          }
        },
        "devices": {
          "type": "array",
          "items": {
            "type": "object",
            "required": ["index", "name"],
            "properties": {
              "index": { "type": "integer", "minimum": 0 },
              "name": { "type": "string" },
              "vendor": { "type": ["string", "null"] },
              "vendor_id": {
                "type": ["string", "null"],
                "pattern": "^[0-9a-f]{4,8}$"
              },
              "device_id": {
                "type": ["string", "null"],
                "pattern": "^[0-9a-f]{4,8}$"
              },
              "uuid": { "type": ["string", "null"] },
              "driver_version": { "type": ["string", "null"] },
              "pci_bus_id": { "type": ["string", "null"] },
              "memory_total_mib": {
                "type": ["integer", "null"],
                "minimum": 0
              },
              "adapter_ram_mib": {
                "type": ["integer", "null"],
                "minimum": 0
              },
              "pnp_device_id": { "type": ["string", "null"] },
              "sources": {
                "type": "array",
                "items": { "type": "string" },
                "uniqueItems": true
              }
            }
          }
        },
        "reason": { "type": "string" }
      }
    },
    "browser": {
      "type": ["object", "null"],
      "description": "Browser identity for webgpu-browser path.",
      "properties": {
        "userAgent": { "type": "string" },
        "executablePath": { "type": "string" },
        "headless": { "type": "boolean" },
        "launchArgs": { "type": "array", "items": { "type": "string" } }
      }
    },
    "kernel": {
      "type": "object",
      "required": ["name", "wgsl_sha256"],
      "description": "Identifies the exact compute kernel that ran. The wgsl_sha256 field lets a reviewer cryptographically verify the same shader source bytes were dispatched.",
      "properties": {
        "name": { "type": "string", "description": "Kernel entry point name (e.g. 'fold', 'reduce_residual')." },
        "wgsl_path": { "type": ["string", "null"], "description": "Repo-relative path to the .wgsl source file, or null for a non-WGSL path." },
        "wgsl_sha256": { "type": ["string", "null"], "pattern": "^[0-9a-f]{64}$", "description": "SHA-256 of the WGSL source bytes (UTF-8), or null for a non-WGSL path." },
        "workgroup_size": { "type": ["array", "null"], "items": { "type": "number" }, "minItems": 1, "maxItems": 3 },
        "dispatch_size": { "type": ["array", "null"], "items": { "type": "number" }, "minItems": 1, "maxItems": 3 }
      }
    },
    "protocol_commit": {
      "type": ["string", "null"],
      "description": "Git SHA of the harness/protocol doc at capture time. Lets a reviewer pin the receipt to a specific protocol version."
    },
    "code_provenance": {
      "type": "object",
      "description": "Content-addressed identity for the executable evidence path. relevant_paths_clean is scoped to the listed inputs, not the whole repository.",
      "required": ["relevant_paths_clean", "inputs"],
      "properties": {
        "relevant_paths_clean": { "type": ["boolean", "null"] },
        "inputs": {
          "type": "array",
          "minItems": 1,
          "items": {
            "type": "object",
            "required": ["path", "sha256"],
            "properties": {
              "path": { "type": "string" },
              "sha256": { "type": "string", "pattern": "^[0-9a-f]{64}$" }
            }
          }
        }
      }
    },
    "results": {
      "type": "array",
      "minItems": 1,
      "items": {
        "type": "object",
        "required": ["op", "trials", "median_us"],
        "properties": {
          "op": { "type": "string" },
          "scale": { "type": "string" },
          "n": { "type": "number" },
          "trials": { "type": "number" },
          "median_us": { "type": "number" },
          "p95_us": { "type": "number" },
          "min_us": { "type": "number" },
          "max_us": { "type": "number" }
        }
      }
    },
    "notes": {
      "type": "array",
      "items": { "type": "string" }
    },
    "ots_proof_path": {
      "type": ["string", "null"],
      "description": "Path to the OpenTimestamps .ots sidecar that anchors this receipt to Bitcoin. Produced by a follow-up sign step; null if not yet anchored."
    },
    "anchor_chain": {
      "type": ["string", "null"],
      "description": "On-chain anchor identifier (e.g. 'base-mainnet:0x...' or 'base-sepolia:0x...'). Null if not yet anchored."
    }
  }
}
